{
  "$schema": "http://json-schema.org/draft-07/schema#",
  "title": "Notion Dashboard Scene Schema",
  "description": "Schema for a scene displaying a Notion-like dashboard within a browser frame.",
  "type": "object",
  "required": [
    "type",
    "mainHeading",
    "subHeading",
    "browserUrl",
    "dashboardTitle",
    "sections"
  ],
  "properties": {
    "type": {
      "type": "string",
      "enum": ["notionDashboard"],
      "description": "The type of the scene, used for component mapping."
    },
    "mainHeading": {
      "type": "string",
      "description": "The main heading text below the browser frame."
    },
    "subHeading": {
      "type": "string",
      "description": "The subheading text below the browser frame."
    },
    "browserUrl": {
      "type": "string",
      "format": "uri",
      "description": "The URL displayed in the browser frame's address bar."
    },
    "dashboardTitle": {
      "type": "string",
      "description": "The title of the Notion-like dashboard."
    },
    "sections": {
      "type": "array",
      "description": "An array of sections within the dashboard.",
      "items": {
        "type": "object",
        "required": ["title", "emoji", "items"],
        "properties": {
          "title": {
            "type": "string",
            "description": "The title of the dashboard section."
          },
          "emoji": {
            "type": "string",
            "description": "An emoji character for the section title."
          },
          "items": {
            "type": "array",
            "description": "An array of items within the section.",
            "items": {
              "type": "object",
              "required": ["text", "checked"],
              "properties": {
                "text": {
                  "type": "string",
                  "description": "The text content of the dashboard item."
                },
                "checked": {
                  "type": "boolean",
                  "description": "Whether the item's checkbox is checked."
                }
              }
            }
          }
        }
      }
    }
  }
}